{
    "schema_version": 1,
    "set_id": "L15-pc_many_clones-003",
    "clusters": [
        {
            "id": "c1",
            "group_id": "A",
            "clone_type": "type-2",
            "granularity": "method",
            "normalized_by": [
                "comments",
                "identifiers"
            ],
            "token_hash": "f1e5708cf467f899",
            "normalized_hash": "653f9a74aa6b1cb6",
            "members": [
                {
                    "file": "src/ManyCloneA.php",
                    "start_line": 9,
                    "end_line": 33,
                    "symbol": "computeTotals",
                    "pristine": true
                },
                {
                    "file": "src/ManyCloneB.php",
                    "start_line": 18,
                    "end_line": 43,
                    "symbol": "computeTotals",
                    "pristine": false
                },
                {
                    "file": "src/ManyCloneC.php",
                    "start_line": 24,
                    "end_line": 51,
                    "symbol": "computeTotals",
                    "pristine": false
                },
                {
                    "file": "src/ManyCloneD.php",
                    "start_line": 25,
                    "end_line": 49,
                    "symbol": "computeTotals",
                    "pristine": false
                }
            ],
            "detection_expectation": {
                "text_based": false,
                "token_based": true,
                "ast_based": true,
                "metric_based": true,
                "semantic": true
            },
            "notes": "L15: pc_many_clones + CM-01 + CM-02 + CM-03."
        }
    ],
    "non_duplicates": [
        {
            "file": "src/ManyCloneDistractor.php",
            "start_line": 12,
            "end_line": 28,
            "reason": "Near-miss: similar invoice",
            "trap": true
        }
    ],
    "scoring": {
        "line_tolerance": 3,
        "member_jaccard_min": 0.6,
        "min_members_for_credit": 3
    }
}
