{
    "schema_version": 1,
    "set_id": "L02-ws_newline-003",
    "clusters": [
        {
            "id": "c1",
            "group_id": "A",
            "clone_type": "type-1",
            "granularity": "method",
            "normalized_by": [
                "whitespace",
                "comments"
            ],
            "token_hash": "f1e5708cf467f899",
            "normalized_hash": "73a3247b26011bdd",
            "members": [
                {
                    "file": "src/LedgerPostingService.php",
                    "start_line": 9,
                    "end_line": 33,
                    "symbol": "computeTotals",
                    "pristine": true
                },
                {
                    "file": "src/PriceBookService.php",
                    "start_line": 18,
                    "end_line": 42,
                    "symbol": "computeTotals",
                    "pristine": false
                },
                {
                    "file": "src/SettlementService.php",
                    "start_line": 24,
                    "end_line": 48,
                    "symbol": "computeTotals",
                    "pristine": false
                }
            ],
            "detection_expectation": {
                "text_based": false,
                "token_based": true,
                "ast_based": true,
                "metric_based": true,
                "semantic": true
            },
            "notes": "Newline variations (WS-10). Token-based detectors should match all three; text-based will not."
        }
    ],
    "non_duplicates": [
        {
            "file": "src/MarginReporter.php",
            "start_line": 12,
            "end_line": 28,
            "reason": "near-miss: same invoice vocabulary and foreach shape, but computes revenue/cost margins and a ratio — a different result",
            "trap": true
        }
    ],
    "scoring": {
        "line_tolerance": 2,
        "member_jaccard_min": 0.6,
        "min_members_for_credit": 2
    }
}
