{
    "schema_version": 1,
    "set_id": "L05-st_combined-001",
    "clusters": [
        {
            "id": "c1",
            "group_id": "A",
            "clone_type": "type-3",
            "granularity": "method",
            "normalized_by": [
                "whitespace",
                "comments",
                "identifiers",
                "literals"
            ],
            "token_hash": "f1e5708cf467f899",
            "normalized_hash": "88b44d89704ac03f",
            "members": [
                {
                    "file": "src/PristineInvoiceCalc.php",
                    "start_line": 9,
                    "end_line": 33,
                    "symbol": "computeTotals",
                    "pristine": true
                },
                {
                    "file": "src/ComboInvoiceCalc.php",
                    "start_line": 18,
                    "end_line": 44,
                    "symbol": "computeTotals",
                    "pristine": false
                },
                {
                    "file": "src/FullComboInvoiceCalc.php",
                    "start_line": 24,
                    "end_line": 51,
                    "symbol": "computeTotals",
                    "pristine": false
                }
            ],
            "detection_expectation": {
                "text_based": false,
                "token_based": true,
                "ast_based": true,
                "metric_based": true,
                "semantic": true
            },
            "notes": "st_combined applies ST-01 (insert_logging) + ST-02 (insert_dead) + ST-09 (expr_tweak) in combination. Carrier B gets 2 transforms, Carrier C gets all 3."
        }
    ],
    "non_duplicates": [
        {
            "file": "src/MarginSummarizer.php",
            "start_line": 12,
            "end_line": 28,
            "reason": "near-miss: same invoice line-item vocabulary and foreach-over-items shape, but computes revenue/cost/margin instead of subtotal/tax/total — a different result",
            "trap": true
        }
    ],
    "scoring": {
        "line_tolerance": 2,
        "member_jaccard_min": 0.6,
        "min_members_for_credit": 2
    }
}
