{
    "schema_version": 1,
    "set_id": "L03-cm_inline_trailing-005",
    "clusters": [
        {
            "id": "c1",
            "group_id": "A",
            "clone_type": "type-1",
            "granularity": "function",
            "normalized_by": [
                "whitespace",
                "comments"
            ],
            "token_hash": "f1e5708cf467f899",
            "normalized_hash": "73a3247b26011bdd",
            "members": [
                {
                    "file": "src/LedgerPostingService.php",
                    "start_line": 9,
                    "end_line": 33,
                    "symbol": "computeTotals",
                    "pristine": true
                },
                {
                    "file": "src/PriceBookService.php",
                    "start_line": 18,
                    "end_line": 46,
                    "symbol": "computeTotals",
                    "pristine": false
                }
            ],
            "detection_expectation": {
                "text_based": true,
                "token_based": true,
                "ast_based": false,
                "metric_based": false,
                "semantic": false
            },
            "notes": "CM-04 inline trailing comment addition (4x // style)."
        }
    ],
    "non_duplicates": [],
    "scoring": {
        "line_tolerance": 2,
        "member_jaccard_min": 0.6,
        "min_members_for_credit": 2
    }
}
