{
    "schema_version": 1,
    "set_id": "L16-am_pipeline-003",
    "clusters": [
        {
            "id": "c1",
            "group_id": "A",
            "clone_type": "type-2",
            "granularity": "method",
            "normalized_by": [
                "identifiers",
                "literals",
                "comments"
            ],
            "token_hash": "f1e5708cf467f899",
            "normalized_hash": "88b44d89704ac03f",
            "members": [
                {
                    "file": "src/PipelineA.php",
                    "start_line": 9,
                    "end_line": 33,
                    "symbol": "computeTotals",
                    "pristine": true
                },
                {
                    "file": "src/PipelineB.php",
                    "start_line": 18,
                    "end_line": 43,
                    "symbol": "computeTotals",
                    "pristine": false
                },
                {
                    "file": "src/PipelineC.php",
                    "start_line": 24,
                    "end_line": 51,
                    "symbol": "computeTotals",
                    "pristine": false
                }
            ],
            "detection_expectation": {
                "text_based": false,
                "token_based": true,
                "ast_based": true,
                "metric_based": true,
                "semantic": true
            },
            "notes": "L16: am_pipeline with multiple transforms."
        }
    ],
    "non_duplicates": [
        {
            "file": "src/PipelineDistractor.php",
            "start_line": 12,
            "end_line": 28,
            "reason": "Near-miss: similar pipeline invoice",
            "trap": true
        }
    ],
    "scoring": {
        "line_tolerance": 2,
        "member_jaccard_min": 0.6,
        "min_members_for_credit": 3
    }
}
