{
    "schema_version": 1,
    "set_id": "L08-adv_heredoc-002",
    "clusters": [
        {
            "id": "c1",
            "group_id": "A",
            "clone_type": "type-2",
            "granularity": "method",
            "normalized_by": [
                "whitespace",
                "comments",
                "identifiers"
            ],
            "token_hash": "acced26c1a39ba09",
            "normalized_hash": "4add1d0737b4536a",
            "members": [
                {
                    "file": "src/RowProcessorA.php",
                    "start_line": 9,
                    "end_line": 78,
                    "symbol": "processRow",
                    "pristine": true
                },
                {
                    "file": "src/RowProcessorB.php",
                    "start_line": 18,
                    "end_line": 87,
                    "symbol": "processRow",
                    "pristine": false
                },
                {
                    "file": "src/RowProcessorC.php",
                    "start_line": 24,
                    "end_line": 93,
                    "symbol": "processRow",
                    "pristine": false
                }
            ],
            "detection_expectation": {
                "text_based": false,
                "token_based": true,
                "ast_based": true,
                "metric_based": false,
                "semantic": false
            },
            "notes": ""
        }
    ],
    "non_duplicates": [],
    "scoring": {
        "line_tolerance": 3,
        "member_jaccard_min": 0.6,
        "min_members_for_credit": 2
    }
}
