{
    "schema_version": 1,
    "set_id": "L10-adv_same_file-001",
    "clusters": [
        {
            "id": "c1",
            "group_id": "A",
            "clone_type": "type-2",
            "granularity": "method",
            "normalized_by": [
                "whitespace",
                "comments",
                "identifiers"
            ],
            "token_hash": "f1e5708cf467f899",
            "normalized_hash": "653f9a74aa6b1cb6",
            "members": [
                {
                    "file": "src/InvoiceCalculatorA.php",
                    "start_line": 9,
                    "end_line": 33,
                    "symbol": "computeTotals",
                    "pristine": true
                },
                {
                    "file": "src/InvoiceCalculatorB.php",
                    "start_line": 18,
                    "end_line": 42,
                    "symbol": "computeTotals",
                    "pristine": true
                },
                {
                    "file": "src/InvoiceCalculatorC.php",
                    "start_line": 24,
                    "end_line": 48,
                    "symbol": "computeTotals",
                    "pristine": true
                }
            ],
            "detection_expectation": {
                "text_based": true,
                "token_based": true,
                "ast_based": true,
                "metric_based": false,
                "semantic": false
            },
            "notes": "CP-01: Intra-file clone topology. Infrastructure gap: SetBuilder does not support placing two clone members in the same file. Set uses standard inter-file placement. True intra-file testing requires manual post-processing or SetBuilder enhancement."
        }
    ],
    "non_duplicates": [
        {
            "file": "src/TrustScorer.php",
            "start_line": 12,
            "end_line": 28,
            "reason": "Near-miss: same invoice calculation vocabulary but computes different result - adds premium support fee",
            "trap": true
        }
    ],
    "scoring": {
        "line_tolerance": 2,
        "member_jaccard_min": 0.7,
        "min_members_for_credit": 2
    }
}
