{
    "schema_version": 2,
    "set_id": "L06-co_5_axis-003",
    "clusters": [
        {
            "id": "c1",
            "group_id": "A",
            "clone_type": "type-3",
            "granularity": "method",
            "normalized_by": [
                "whitespace",
                "comments",
                "identifiers",
                "case_convention",
                "literals"
            ],
            "token_hash": "e2c6d2de09404029",
            "normalized_hash": "d5da572207f4bce3",
            "members": [
                {
                    "file": "src/ConstCalc.php",
                    "start_line": 9,
                    "end_line": 33,
                    "symbol": "computeTotals",
                    "pristine": false,
                    "group": "A",
                    "seed": "invoice_totals"
                },
                {
                    "file": "src/RnLtCalc.php",
                    "start_line": 18,
                    "end_line": 43,
                    "symbol": "computeTotals",
                    "pristine": false,
                    "group": "A",
                    "seed": "invoice_totals",
                    "fragments": [
                        {
                            "start_line": 35,
                            "end_line": 37
                        },
                        {
                            "start_line": 39,
                            "end_line": 60
                        }
                    ],
                    "unique_segments": [
                        {
                            "start_line": 38,
                            "end_line": 38,
                            "lines": 1,
                            "kind": "gap",
                            "reason": "inserted by transform"
                        }
                    ]
                },
                {
                    "file": "src/FiveAxisCalc.php",
                    "start_line": 24,
                    "end_line": 52,
                    "symbol": "computeTotals",
                    "pristine": false,
                    "group": "A",
                    "seed": "invoice_totals",
                    "fragments": [
                        {
                            "start_line": 47,
                            "end_line": 49
                        },
                        {
                            "start_line": 52,
                            "end_line": 59
                        },
                        {
                            "start_line": 61,
                            "end_line": 64
                        },
                        {
                            "start_line": 66,
                            "end_line": 75
                        }
                    ],
                    "unique_segments": [
                        {
                            "start_line": 50,
                            "end_line": 65,
                            "lines": 16,
                            "kind": "gap",
                            "reason": "inserted by transform"
                        }
                    ]
                }
            ],
            "detection_expectation": {
                "text_based": false,
                "token_based": true,
                "ast_based": true,
                "metric_based": true,
                "semantic": true
            },
            "notes": "5-axis interference: WS-01 + RN-05 + LT-03 + LT-04 + ST-01 + ST-02. Tests comprehensive normalization with literal and statement changes."
        }
    ],
    "non_duplicates": [
        {
            "file": "src/MarginSummarizer.php",
            "start_line": 12,
            "end_line": 28,
            "reason": "near-miss: same invoice line-item vocabulary and foreach-over-items shape, but computes revenue/cost/margin instead of subtotal/tax/total",
            "trap": true
        }
    ],
    "scoring": {
        "line_tolerance": 3,
        "member_jaccard_min": 0.45,
        "min_members_for_credit": 2
    }
}
