{
    "schema_version": 1,
    "set_id": "L05-se_payment_processor-005",
    "clusters": [
        {
            "id": "c1",
            "group_id": "A",
            "clone_type": "type-4",
            "granularity": "method",
            "normalized_by": [
                "controlflow",
                "identifiers",
                "literals"
            ],
            "token_hash": "ab29c5185aec0112",
            "normalized_hash": "c34a95ddc4a183a2",
            "members": [
                {
                    "file": "src/DirectPayment.php",
                    "start_line": 9,
                    "end_line": 140,
                    "symbol": "processPayment",
                    "pristine": true
                },
                {
                    "file": "src/RenamedPayment.php",
                    "start_line": 18,
                    "end_line": 152,
                    "symbol": "processPayment",
                    "pristine": false
                },
                {
                    "file": "src/TypedPayment.php",
                    "start_line": 24,
                    "end_line": 158,
                    "symbol": "processPayment",
                    "pristine": false
                }
            ],
            "detection_expectation": {
                "text_based": false,
                "token_based": false,
                "ast_based": false,
                "metric_based": false,
                "semantic": true
            },
            "notes": "Set 005 of 5. RN-01, RN-02, TY-01, TY-02 combined with strategy_object variant."
        }
    ],
    "non_duplicates": [],
    "scoring": {
        "line_tolerance": 2,
        "member_jaccard_min": 0.6,
        "min_members_for_credit": 2
    }
}
