{
    "schema_version": 1,
    "set_id": "L10-adv_boundary-003",
    "clusters": [
        {
            "id": "c1",
            "group_id": "A",
            "clone_type": "type-2",
            "granularity": "method",
            "normalized_by": [
                "whitespace",
                "comments",
                "identifiers"
            ],
            "token_hash": "f1e5708cf467f899",
            "normalized_hash": "653f9a74aa6b1cb6",
            "members": [
                {
                    "file": "src/TotalsCalculatorA.php",
                    "start_line": 9,
                    "end_line": 33,
                    "symbol": "computeTotals",
                    "pristine": true
                },
                {
                    "file": "src/TotalsCalculatorB.php",
                    "start_line": 18,
                    "end_line": 49,
                    "symbol": "computeTotals",
                    "pristine": false
                },
                {
                    "file": "src/TotalsCalculatorC.php",
                    "start_line": 24,
                    "end_line": 54,
                    "symbol": "computeTotals",
                    "pristine": false
                }
            ],
            "detection_expectation": {
                "text_based": true,
                "token_based": true,
                "ast_based": true,
                "metric_based": false,
                "semantic": false
            },
            "notes": "CP-04: Set 003 straddles the boundary - some carriers at 5 lines, others at 6. Tests off-by-one asymmetry."
        }
    ],
    "non_duplicates": [
        {
            "file": "src/ReceiptCalculator.php",
            "start_line": 12,
            "end_line": 28,
            "reason": "Near-miss: same invoice vocabulary but computes receipt totals differently",
            "trap": true
        }
    ],
    "scoring": {
        "line_tolerance": 1,
        "member_jaccard_min": 0.8,
        "min_members_for_credit": 2
    }
}
